block_name,template_name,template_path,active,products,placeholder.title.de_DE,placeholder.title.en_US,placeholder.description.de_DE,placeholder.description.en_US
Teaser for home page,Title and description block,@CmsBlock/template/title_and_description_block.twig,1,,<h2 class="common-section__title">Ihre Erfahrung - <br>unsere Priorität</h2>,<h2 class="common-section__title">Your Experience is Our Priority</h2>,"<p class=""common-section__text"">Schauen Sie auf die Tische Ihrer Mitarbeiter um zu sehen, dass Schreibwaren ein wichtiger Teil des täglichen Büroalltags sind. Stifte und anderes Zubehör wie Lineale, Spitzer, Radiergummis, <a class=""common-section__link"" href=""/de/b%C3%BCroausstattung/computerzubeh%C3%B6r"">Computerzubehör</a>, Locher, Scheren und mehr sind wichtige Werkzeuge Ihrer Mitarbeiter. Ohne <a class=""common-section__link"" href=""/de/b%C3%BCrobedarf/schreibwaren/kugelschreiber"">Kugelschreiber</a> wird Ihre Firma nicht in der Lage sein, ihre tägliche Arbeit zu erledigen.</p>
<p class=""common-section__text"">Von Ihrem Schreibtisch im Büro, in Besprechungen, Schulungen oder bei Ihnen zu Hause <br> bei uns finden Sie für jeden Bedarf und Anlass das passende Büro-Zubehör. Unser großes Sortiment an Büromaterialien bietet eine riesige Auswahl an praktischen <a class=""common-section__link"" href=""/de/b%C3%BCrobedarf/schreibwaren"">Schreibwaren</a>, Accessoires und Möbeln. Bestellen Sie jetzt bekannte Marken wie Edding, Stabilo, Pelikan und Faber Castell online.</p>","<p class=""common-section__text"">Look at any desktop to know that stationary is an important part of your employees day-to-day organization. Pens and other accessories such as rulers, sharpeners, erasers, <a class=""common-section__link"" href=""/en/office-equipment/computer-accessories"">computer accessories</a>, hole punches, scissors and more are your employees' most critical tools. Without a ballpoint <a class=""common-section__link"" href=""/en/stationery/writing-materials/pens"">pen</a>, your company will not be able to do their daily work.</p>
<p class=""common-section__text"">From your desk in the office, in meetings, trainings, or in your home <br> you will find suitable stationery for every need and purpose. Our wide assortment of office supplies offers a large selection of practical stationery, accessories and <a class=""common-section__link"" href=""http:/en/office-furniture"">furniture</a>. Order well-known brands like Edding, Stabilo, Pelikan and Faber Castell online now.</p>"
Home Page,Title and description block,@CmsBlock/template/title_and_description_block.twig,1,,Empfohlene Produkte,Featured Products,"<p>{{ product_group(['035', '066', '078', '086', '093','139']) }}</p>","<p>{{ product_group(['035', '066', '078', '086', '093','139']) }}</p>"
Product SEO content,Title and description block,@CmsBlock/template/title_and_description_block.twig,1,,Product CMS Block,Product CMS Block,"<p class='columns'>Sed imperdiet non quam nec molestie. Integer eu ipsum non odio dignissim rutrum. Proin malesuada metus ac tempor convallis. Pellentesque finibus, urna et vestibulum egestas, metus purus porta ligula, sit amet tincidunt dui justo vel nulla. Nam sodales nisi vel augue consectetur malesuada. Nulla semper neque a nunc tristique ullamcorper. Mauris at nisi non elit fringilla commodo. Curabitur at libero sed nisl condimentum cursus eget nec ligula. Aenean nec elit ut lacus feugiat fermentum. Phasellus quis quam mi. Duis id arcu quis ipsum viverra egestas at at diam. Cras vel dui maximus, scelerisque dui ut, suscipit lectus.</p>","<p class='columns'>Ut cursus, ligula vel pretium porta, justo nulla consectetur mauris, in aliquet nisl sapien feugiat lectus. Pellentesque sit amet sagittis justo, congue fringilla lacus. Sed vel dui et nunc sodales feugiat non in erat. Aliquam nunc mi, dignissim id tempor bibendum, sodales a tellus. Aliquam vitae efficitur turpis, quis consequat neque. Suspendisse interdum semper mi. Cras tortor justo, pretium at convallis a, lobortis non lorem. Duis ullamcorper sagittis efficitur. In erat libero, suscipit ac metus in, varius laoreet neque. Morbi ligula arcu, rutrum facilisis varius non, viverra id dui. Curabitur accumsan ultricies mauris eget vestibulum. Mauris pellentesque molestie nibh eu finibus. Fusce ut gravida massa, et vehicula arcu. Class aptent taciti sociosqu ad litora torquent per conubia nostra, per inceptos himenaeos. Sed convallis erat ut mi pretium dapibus. Ut orci leo, scelerisque vitae velit a, ultricies porta ligula.</p>"
Category CMS page showcase for Top position,Title and description block,@CmsBlock/template/title_and_description_block.twig,1,,Category CMS page showcase for Top position,Category CMS page showcase for Top position,"<p class='columns'>Sed imperdiet non quam nec molestie. Integer eu ipsum non odio dignissim rutrum. Proin malesuada metus ac tempor convallis. Pellentesque finibus, urna et vestibulum egestas, metus purus porta ligula, sit amet tincidunt dui justo vel nulla. Nam sodales nisi vel augue consectetur malesuada. Nulla semper neque a nunc tristique ullamcorper. Mauris at nisi non elit fringilla commodo. Curabitur at libero sed nisl condimentum cursus eget nec ligula. Aenean nec elit ut lacus feugiat fermentum. Phasellus quis quam mi. Duis id arcu quis ipsum viverra egestas at at diam. Cras vel dui maximus, scelerisque dui ut, suscipit lectus.</p>","<p class='columns'>Ut cursus, ligula vel pretium porta, justo nulla consectetur mauris, in aliquet nisl sapien feugiat lectus. Pellentesque sit amet sagittis justo, congue fringilla lacus. Sed vel dui et nunc sodales feugiat non in erat. Aliquam nunc mi, dignissim id tempor bibendum, sodales a tellus. Aliquam vitae efficitur turpis, quis consequat neque. Suspendisse interdum semper mi. Cras tortor justo, pretium at convallis a, lobortis non lorem. Duis ullamcorper sagittis efficitur. In erat libero, suscipit ac metus in, varius laoreet neque. Morbi ligula arcu, rutrum facilisis varius non, viverra id dui. Curabitur accumsan ultricies mauris eget vestibulum. Mauris pellentesque molestie nibh eu finibus. Fusce ut gravida massa, et vehicula arcu. Class aptent taciti sociosqu ad litora torquent per conubia nostra, per inceptos himenaeos. Sed convallis erat ut mi pretium dapibus. Ut orci leo, scelerisque vitae velit a, ultricies porta ligula.</p>"
Category CMS page showcase for Middle position,Title and description block,@CmsBlock/template/title_and_description_block.twig,1,,Category CMS page showcase for Middle position,Category CMS page showcase for Middle position,<p class='columns'>Sed imperdiet non quam nec molestie. Integer eu ipsum non odio dignissim rutrum.</p>,"<p class='columns'>Ut cursus, ligula vel pretium porta, justo nulla consectetur mauris, in aliquet nisl sapien feugiat lectus.</p>"
Category CMS page showcase for Bottom position,Title and description block,@CmsBlock/template/title_and_description_block.twig,1,,Category CMS page showcase for Bottom position,Category CMS page showcase for Bottom position,"<p class='columns'>Sed imperdiet non quam nec molestie. Integer eu ipsum non odio dignissim rutrum. Proin malesuada metus ac tempor convallis. Pellentesque finibus, urna et vestibulum egestas, metus purus porta ligula, sit amet tincidunt dui justo vel nulla. Nam sodales nisi vel augue consectetur malesuada. Nulla semper neque a nunc tristique ullamcorper. Mauris at nisi non elit fringilla commodo. Curabitur at libero sed nisl condimentum cursus eget nec ligula. Aenean nec elit ut lacus feugiat fermentum. Phasellus quis quam mi. Duis id arcu quis ipsum viverra egestas at at diam. Cras vel dui maximus, scelerisque dui ut, suscipit lectus.</p>","<p class='columns'>Ut cursus, ligula vel pretium porta, justo nulla consectetur mauris, in aliquet nisl sapien feugiat lectus. Pellentesque sit amet sagittis justo, congue fringilla lacus. Sed vel dui et nunc sodales feugiat non in erat. Aliquam nunc mi, dignissim id tempor bibendum, sodales a tellus. Aliquam vitae efficitur turpis, quis consequat neque. Suspendisse interdum semper mi. Cras tortor justo, pretium at convallis a, lobortis non lorem. Duis ullamcorper sagittis efficitur. In erat libero, suscipit ac metus in, varius laoreet neque. Morbi ligula arcu, rutrum facilisis varius non, viverra id dui. Curabitur accumsan ultricies mauris eget vestibulum. Mauris pellentesque molestie nibh eu finibus. Fusce ut gravida massa, et vehicula arcu. Class aptent taciti sociosqu ad litora torquent per conubia nostra, per inceptos himenaeos. Sed convallis erat ut mi pretium dapibus. Ut orci leo, scelerisque vitae velit a, ultricies porta ligula.</p>"
CMS block for category Computers,Title and description block,@CmsBlock/template/title_and_description_block.twig,1,,"<p style=""text-align: center; ""><b><span style=""font-size: 24px;"">DAS IST EINE LANDING PAGE FÜR COMPUTERS</span></b></p>","<p style=""text-align: center; ""><b><span style=""font-size: 24px;"">THIS IS A LANDING PAGE FOR COMPUTERS</span></b></p>","</p><p></p><p><br></p><p>Sed volutpat felis non elit elementum fermentum. Sed sit amet nunc lacinia ligula malesuada pretium. Duis imperdiet sem id nibh tristique, non convallis nunc luctus. Fusce congue vestibulum purus in rhoncus. Suspendisse eu nisl non diam ornare convallis. Nullam cursus, magna vitae porttitor consectetur, leo justo volutpat augue, vitae gravida eros metus ac diam. Donec iaculis diam at massa posuere posuere. Ut molestie, mauris nec tempus aliquam, massa mauris pellentesque ligula, eu mattis quam diam nec magna. Nunc ante odio, pulvinar ac nisl quis, efficitur eleifend enim. Nam consectetur placerat ligula, nec aliquet eros feugiat quis.</p><p>Sed eget imperdiet dolor. Nullam fringilla facilisis odio eu mattis. Morbi nibh erat, ornare et malesuada vel, commodo vel ligula. Donec maximus odio dolor, in aliquam mi tempus eu. Vivamus imperdiet imperdiet hendrerit. Pellentesque habitant morbi tristique senectus et netus et malesuada fames ac turpis egestas. Donec quis dapibus libero, id sagittis dolor. Sed efficitur malesuada turpis sit amet efficitur. Etiam mattis ex elit, sit amet cursus sapien maximus id. Pellentesque habitant morbi tristique senectus et netus et malesuada fames ac turpis egestas.</p><p><br></p><p><b>This is a list of product groups in a CMS page:</b><br></p>

{{ product_group(['139', '141', '152', '140', '143', '150', '132', '151']) }}","</p><p></p><p><br></p><p>Sed volutpat felis non elit elementum fermentum. Sed sit amet nunc lacinia ligula malesuada pretium. Duis imperdiet sem id nibh tristique, non convallis nunc luctus. Fusce congue vestibulum purus in rhoncus. Suspendisse eu nisl non diam ornare convallis. Nullam cursus, magna vitae porttitor consectetur, leo justo volutpat augue, vitae gravida eros metus ac diam. Donec iaculis diam at massa posuere posuere. Ut molestie, mauris nec tempus aliquam, massa mauris pellentesque ligula, eu mattis quam diam nec magna. Nunc ante odio, pulvinar ac nisl quis, efficitur eleifend enim. Nam consectetur placerat ligula, nec aliquet eros feugiat quis.</p><p>Sed eget imperdiet dolor. Nullam fringilla facilisis odio eu mattis. Morbi nibh erat, ornare et malesuada vel, commodo vel ligula. Donec maximus odio dolor, in aliquam mi tempus eu. Vivamus imperdiet imperdiet hendrerit. Pellentesque habitant morbi tristique senectus et netus et malesuada fames ac turpis egestas. Donec quis dapibus libero, id sagittis dolor. Sed efficitur malesuada turpis sit amet efficitur. Etiam mattis ex elit, sit amet cursus sapien maximus id. Pellentesque habitant morbi tristique senectus et netus et malesuada fames ac turpis egestas.</p><p><br></p><p><b>This is a list of product groups in a CMS page:</b><br></p>

{{ product_group(['139', '141', '152', '140', '143', '150', '132', '151']) }}"
Main slide-1,Main slider block,@CmsBlock/template/main_slider_block.twig,1,,Möbel - <br>Erneuern Sie Ihr Büro,Furniture - <br>Upgrade Your Office,"Erreichen Sie jede Deadline mit Leichtigkeit, mit bequemen und funktionalen Stühlen, Tischen und mehr.","Tackle your to-do list in comfortable and functional chairs, desks, and more."
Main slide-2,Main slider block,@CmsBlock/template/main_slider_block.twig,1,,Bürobedarf - <br>Platz für Ihre Ideen,Stationary - <br>Power What You Do,"Bleiben Sie immer organisiert und behalten Sie Ordnung, qualitativ hochwertige Schreibwaren.",Stay organized and focused with the best quality office supplies available.
Main slide-3,Main slider block,@CmsBlock/template/main_slider_block.twig,1,,Büroausstattung - <br>Zubehör & mehr,Office Equipment - <br>Accessories & More,Lassen Sie Ihr Büro in neuem Glanz erstrahlen mit technischem Equipment und weiterem Zubehör.,Keep your office up-to-date with the latest technology and accessories.
Featured Products,Title and description block,@CmsBlock/template/title_and_description_block.twig,1,,"<h2 class=""common-section__title"">Produktangebote</h2>
<p class=""common-section__sub-title"">Es ist zwar Arbeit, aber es muss sich nicht danach anfühlen. Sehen Sie sich unsere Produktangebote an.</p>","<h2 class=""common-section__title"">Featured Products</h2>
<p class=""common-section__sub-title"">It might be work, but it doesn't have to feel like it. Explore some of our featured items.</p>","{{ product_group(['M1896','B0001','M14054','M21091','M21104','M1896','M14054','M21091','M21104'], 'slider') }}","{{ product_group(['M1896','B0001','M14054','M21091','M21104','M1896','M14054','M21091','M21104'], 'slider') }}"
Top Sellers,Title and description block,@CmsBlock/template/title_and_description_block.twig,1,,"<h2 class=""common-section__title"">Topseller</h2>
<p class=""common-section__sub-title"">Sehen Sie sich die beliebtesten Büromöbel und Schreibwaren unseres Stores an.</p>","<h2 class=""common-section__title"">Top sellers</h2>
<p class=""common-section__sub-title"">See what other customers enjoy most from our wide selection of top quality furniture and supplies.</p>","{{ product_group(['M1896','M14054','M21091','M21104','M1896','M14054','M21091','M21104'], 'slider') }}","{{ product_group(['M1896','M14054','M21091','M21104','M1896','M14054','M21091','M21104'], 'slider') }}"
Featured Categories,Banner grid block,@CmsBlock/template/banner_grid_block.twig,1,,<h2 class="common-section__title">Beliebte Kategorien</h2>,<h2 class="common-section__title">Featured Categories</h2>,<p><br></p>,<p><br></p>
Category Banner-1,Banner block,@CmsBlock/template/banner_block.twig,1,,Tische,Tables,Egal ob kleine Einzel<br>- oder große Meeting-Tische <br>- sehen Sie sich unsere große Auswahl an hochwertigen Bürotischen an.,"From personal use to the boardroom, check out our large selection of high-quality office tables."
Category Banner-2,Banner block,@CmsBlock/template/banner_block.twig,1,,Schreibwaren,Writing Materials,"Eine riesige Auswahl an Kugelschreiber, Marker, Stiften und vielen mehr. Hier ist für jeden etwas dabei.","Stock up on the perfect pens, pencils, and markers for every member of your team."
Category Banner-3,Banner block,@CmsBlock/template/banner_block.twig,1,,Haftnotizen,Post-Its,Mit Haftnotzizzetteln jeder Form und Größe bleiben Sie und Ihr Team jederzeit organisiert und produktiv.,Organize and prioritize yourself or your team using our great selection of Post-Its.
Category Banner-4,Banner block,@CmsBlock/template/banner_block.twig,1,,Bürostühle,Office Chairs,"Finden Sie den richtigen Stuhl, der sowohl komfortabel ist, als auch ein modernes Design hat.",Find the right chairs that are <br>both comfortable <br>and stylish.
Category Block Bottom,Title and description block,@CmsBlock/template/title_and_description_block.twig,1,,<h2>Schaffen Sie eine einladende Arbeitsatmosphäre</h2>,<h2>Build a Space That Spurs Creativity</h2>,"<p>Nur weil es Arbeit ist, muss es sich nicht danach anfühlen. Überarbeiten Sie Ihre Büroräume, um eine organisierte, funktionale und <a href='/de/b%C3%BCroausstattung'>komfortable Arbeitsatmosphäre</a> zu schaffen, indem Sie aus Spryker's großer Auswahl wählen.</p> <p>Das Büro ist ein Ort, an dem die Leute die meiste Zeit ihres Tages verbringen. Deshalb hat es sich Spryker zur Aufgabe gemacht, sicherzustellen, dass <a href='/de/b%C3%BCrobedarf'>unsere Produktauswahl</a> Ihren Raum in einen einladenden, produktiven und kreativen Bereich verwandelt, um die besten Tallente für Sie zu gewinnen.</p>","<p>Just because it's work, doesn't mean it should feel like it. Complete your office space to create an organized, functional, and comfortable <a href='/en/office-equipment'>working environment</a> utilizing any item from Spryker's large selection.</p> <p>The office is a place where people spend a majority of their time, so Spryker has made it our mission to ensure <a href='/en/stationery'>our selection transforms your space</a> into a welcoming, productive, and creative area in order to attract and develop the best talent for your industry.</p>"
Category Block Middle,Title and description block,@CmsBlock/template/title_and_description_block.twig,1,,<h2>Greifen Sie Ihre To-Dos an</h2>,<h2>Tackle Your To-Do's</h2>,"<p>Seien Sie der Büroheld und schaffen Sie mit zuverlässigen Artikel einen besseren Platz zum Arbeiten. Suchen Sie in der großen Auswahl von Spryker nach den besten <a href='/de/b%C3%BCrom%C3%B6bel'>Büromöbeln</a>, <a href='/de/b%C3%BCroausstattung/computerzubeh%C3%B6r'>Zubehör</a> und Elektronik in einer unübertroffenen Qualität und immer niedrigen Preisen.</p>","<p>Be the office hero by adding durable and reliable products to make your space a great place to work. Search Spryker's wide selection to find the best <a href='/en/office-furniture'>office furniture</a>, supplies, and <a href='/en/office-equipment/computer-accessories'>electronics</a> at an unmatched quality and always low price.</p>"
Product CMS Block,Product Block,@CmsBlock/template/product-cms-block.twig,1,,Schaffen Sie eine einladende Arbeitsatmosphäre,Build a Space That Spurs Creativity,"<p>Nur weil es Arbeit ist, muss es sich nicht danach anfühlen. Überarbeiten Sie Ihre Büroräume, um eine organisierte, funktionale und <a href=""/de/b%C3%BCroausstattung"">komfortable Arbeitsatmosphäre</a> zu schaffen, indem Sie aus Spryker's großer Auswahl wählen.</p>
    <p>Das Büro ist ein Ort, an dem die Leute die meiste Zeit ihres Tages verbringen. Deshalb hat es sich Spryker zur Aufgabe gemacht, sicherzustellen, dass <a href=""/de/b%C3%BCrobedarf"">unsere Produktauswahl</a> Ihren Raum in einen einladenden, produktiven und kreativen Bereich verwandelt, um die besten Tallente für Sie zu gewinnen.</p>","<p>Just because it's work, doesn't mean it should feel like it. Complete your office space to create an organized, functional, and comfortable <a href=""/en/office-equipment"">working environment</a> utilizing any item from Spryker's large selection.</p>
    <p>The office is a place where people spend a majority of their time, so Spryker has made it our mission to ensure <a href=""/en/stationery"">our selection transforms your space</a> into a welcoming, productive, and creative area in order to attract and develop the best talent for your industry.</p>"
